filename,notes,authors,licenses,urls
"head/heads/human/female/jump.png","original head by Redshrike, tweaks by BenCreating, modular version by bluecarrot16","bluecarrot16, Benjamin K. Smith (BenCreating), Stephen Challener (Redshrike)","OGA-BY 3.0, CC-BY-SA 3.0, GPL 3.0","https://opengameart.org/content/, https://opengameart.org/content/lpc-character-bases"
"head/faces/female/neutral/jump.png","Original by Redshrike, Expressions by ElizaWy, mapped to all frames by JaidynReiman","JaidynReiman, ElizaWy, Stephen Challener (Redshrike)","OGA-BY 3.0","https://github.com/ElizaWy/LPC/tree/main/Characters/Head, https://opengameart.org/content/ulpc-expanded-expressions"
"hair/long_center_part/adult/fg/jump/light_brown.png","","thecilekli, bluecarrot16","CC0","https://opengameart.org/content/lpc-long-straight-hair-with-12-colors, https://opengameart.org/content/lpc-hair"
"body/bodies/female/jump.png","see details at https://opengameart.org/content/lpc-character-bases","Benjamin K. Smith (BenCreating), bluecarrot16, TheraHedwig, Evert, MuffinElZangano, Durrani, Pierre Vigier (pvigier), ElizaWy, Matthew Krohn (makrohn), Johannes Sjölund (wulax), Stephen Challener (Redshrike)","OGA-BY 3.0, CC-BY-SA 3.0, GPL 3.0","https://opengameart.org/content/liberated-pixel-cup-lpc-base-assets-sprites-map-tiles, https://opengameart.org/content/lpc-medieval-fantasy-character-sprites, https://opengameart.org/content/lpc-ladies, https://opengameart.org/content/lpc-7-womens-shirts, https://opengameart.org/content/lpc-jump-expanded, https://opengameart.org/content/lpc-be-seated, https://opengameart.org/content/lpc-revised-character-basics, https://gitlab.com/vagabondgame/lpc-characters, https://opengameart.org/content/lpc-male-jumping-animation-by-durrani, https://opengameart.org/content/lpc-runcycle-and-diagonal-walkcycle"
"feet/boots/revised/thin/jump/black.png","original by ElizaWy, remaining frames by JaidynReiman","ElizaWy, JaidynReiman, Stephen Challener (Redshrike), Johannes Sjölund (wulax)","OGA-BY 3.0","https://github.com/ElizaWy/LPC/tree/main/Characters/Clothing, https://opengameart.org/content/lpc-expanded-sit-run-jump-more, https://opengameart.org/content/lpc-expanded-socks-shoes"
"eyes/eyebrows/thin/adult/jump/chestnut.png","","ElizaWy","OGA-BY 3.0","https://github.com/ElizaWy/LPC/tree/main/Characters/Hair, https://opengameart.org/content/lpc-expanded-sit-run-jump-more"
"hat/pirate/bonnie/adult/jump/maroon.png","Bonnie Hat by Bluecarrot16, layers and added animations by JaidynReiman","bluecarrot16, JaidynReiman","OGA-BY 3.0","https://opengameart.org/content/lpc-pirates, https://opengameart.org/content/lpc-expanded-hats-facial-helmets"
"torso/clothes/longsleeve/longsleeve/female/jump.png","original by ElizaWy, edited to v3 bases by bluecarrot16; cleanup and climb/jump/run/sit/emote/revised combat adapted from LPC Revised by JaidynReiman","bluecarrot16, ElizaWy, JaidynReiman, Stephen Challener (Redshrike)","OGA-BY 3.0, CC-BY-SA 3.0, GPL 3.0","https://opengameart.org/content/liberated-pixel-cup-lpc-base-assets-sprites-map-tiles, https://opengameart.org/content/lpc-7-womens-shirts, http://opengameart.org/content/lpc-clothing-updates, https://opengameart.org/content/lpc-revised-character-basics, https://github.com/ElizaWy/LPC/tree/main/Characters/Clothing, https://opengameart.org/content/lpc-expanded-sit-run-jump-more, https://opengameart.org/content/lpc-expanded-simple-shirts"
"legs/cuffed/thin/jump.png","Original bases by Redshrike, thrust/shoot bases by Wulax, original cuffed pants by ElizaWy, climb/jump/run/sit/emotes/revised combat by JaidynReiman","ElizaWy, JaidynReiman, Johannes Sjölund (wulax), Stephen Challener (Redshrike)","OGA-BY 3.0","https://github.com/ElizaWy/LPC/tree/main/Characters/Clothing, https://opengameart.org/content/lpc-expanded-sit-run-jump-more, https://opengameart.org/content/lpc-expanded-pants"
